{"$schema":"https://json-schema.org/draft/2020-12/schema","$id":"https://socioprophet.org/contracts/AnonymousReputationReceipt.v0.1.json","title":"AnonymousReputationReceipt","type":"object","additionalProperties":false,"required":["version","receipt_id","created_at","scope_ref","pseudonymous_subject_commitment","event_type","linkability_scope_ref","receipt"],"properties":{"version":{"const":"0.1"},"receipt_id":{"type":"string","minLength":8},"created_at":{"type":"string","format":"date-time"},"scope_ref":{"type":"string","minLength":3},"pseudonymous_subject_commitment":{"type":"string","minLength":16},"event_type":{"type":"string","enum":["contribution","review","moderation","teaching","help_action"]},"event_ref":{"type":"string"},"linkability_scope_ref":{"type":"string","minLength":3},"reputation_delta":{"type":"number"},"evidence_refs":{"type":"array","items":{"type":"string"}},"revocation_token_ref":{"type":"string"},"trace_open_supported":{"type":"boolean"},"receipt":{"type":"object","additionalProperties":false,"required":["hash","algo"],"properties":{"hash":{"type":"string"},"algo":{"type":"string","enum":["sha256","blake3"]}}}}}